Hearing Date,Decision Date,Case Number,Address,Type,Section,Description,Decision
"August 17, 2023 (Virtual Hearing)","September 26, 2023",111 of 2023,6314 Broad Street,Variance,Section 912.04.K.1,"In front and side yards,4’ high maximum fence height, 6’ high fence requested","Decision: The Applicant’s request for variances from Sections 904.02.B.2 and 912.04.K.1to allow accessory uses with a cumulative area of 17,790 sf and a 6’ open fencein the front yard are hereby APPROVED."
"September 10, 2020 (Virtual Hearing)","October 23, 2020",165 of 2020,6315 Forbes Avenue,Variance,Section 903.03.E.2,"Minimum 25’ exterior side setback required, 4’ requested",Decision: The Applicant’s request for a special exception pursuant to Section 919.06 anda dimensional variance from Section 903.03.E.2 to allow a 4’ exterior side setback ishereby APPROVED.
"September 10, 2020 (Virtual Hearing)","October 23, 2020",165 of 2020,6315 Forbes Avenue,Special Exception,Section 916.06/916.09,"Waiver of residential compatibility standards for sound level, 45dB maximum sound level, 60dB requested",Decision: The Applicant’s request for a special exception pursuant to Section 919.06 anda dimensional variance from Section 903.03.E.2 to allow a 4’ exterior side setback ishereby APPROVED.
"May 4, 2023 (Virtual Hearing)","June 2, 2023",50 of 2023,6342 Jackson Street,Special Exception,Section 912.05.B.1,Only individuals who are residents of the dwelling unit may be engaged in the home occupation; two non-resident employees proposed,"Decision: The Applicant’s request for a special exception pursuant to Section 912.05.B.1and a variance from Section 912.04.L to allow for a sewing workshop as ahome occupation, as described to the Board, with no more than two non-resident employees and employee parking in the driveway is herebyAPPROVED. The request for approval of signage for the use is DENIED."
"May 4, 2023 (Virtual Hearing)","June 2, 2023",50 of 2023,6342 Jackson Street,Variance,Section 912.04.L,Parking shall be set back 5’ from the front of the house; parking in front yard proposed on existing driveway,"Decision: The Applicant’s request for a special exception pursuant to Section 912.05.B.1and a variance from Section 912.04.L to allow for a sewing workshop as ahome occupation, as described to the Board, with no more than two non-resident employees and employee parking in the driveway is herebyAPPROVED. The request for approval of signage for the use is DENIED."
"January 2, 2025","March 10, 2025",172 of 2024,6345 Marchand Street,Variance,Section 911.02,Multi-unit residential is not permitted in R2-M District,"Decision: The Applicant’s request for variances from Section 903.03 and 911.02 to allowthe development of a four-unit residential structure on the Subject Propertywith a limited rear setback is hereby APPROVED.RECUSEDAlice B. Mitinger, Chair"
"January 2, 2025","March 10, 2025",172 of 2024,6345 Marchand Street,Variance,Section 911.02,30’ rear setback required,"Decision: The Applicant’s request for variances from Section 903.03 and 911.02 to allowthe development of a four-unit residential structure on the Subject Propertywith a limited rear setback is hereby APPROVED.RECUSEDAlice B. Mitinger, Chair"
"January 2, 2025","March 10, 2025",172 of 2024,6345 Marchand Street,Variance,Section 911.02,"1,800 sf minimum lot size per unit required; 1,500 sf lot size per unit proposed","Decision: The Applicant’s request for variances from Section 903.03 and 911.02 to allowthe development of a four-unit residential structure on the Subject Propertywith a limited rear setback is hereby APPROVED.RECUSEDAlice B. Mitinger, Chair"
"November 9, 2023 (Virtual Hearing)","December 21, 2023",164 of 2023,6346 Walnut Street,Variance,Section 912.04.L,Parking pads must be 5’ behind front of primary structure; front yard parking pad proposed,"Decision: The Applicant’s request for a variance from Section 912.04.L to allow for a one-car parking pad in the front yard of the Subject Property is hereby DENIED.RECUSEDAlice B. Mitinger, Chair"
"December 8, 2022 (Virtual Hearing)","January 19, 2023",256 of 2022,6350 Apple Street,Special Exception,Section 921.02.A.4,Change of one nonconforming use to another (Vehicle/Equipment Sales (Limited)),"Decision: The Applicant’s request for a special exception pursuant to Code Section921.02.A.4 to allow a vehicle/equipment sales (limited) use, with the operationalaspects described to the Board, is hereby APPROVED."
"March 21, 2024","April 24, 2024",15 of 2024,64 S. 19th Street,Variance/Review,Section 911.02,Three-unit residential is not a permitted use in R1A-VH District,Decision: The use of the structure for three units is legally nonconforming and maycontinue.
640 Casino Drive (Virtual Hearing),"August 9, 2021",124 of 2021,640 Casino Drive,Variance,Section 905.04.I.2,"Modify a condition of ZBA Case No. 287 of 2016 to allow continued use of commercial surface parking lot that exceeds maximum permitted in district. Original condition required applicant to bring the lot into compliance with the Code’s maximum permitted surface parking requirements within 7 years after the issuance of a building permit for the Carnegie Science Center addition. (Building permit issued in April 2017.) The original variance was granted under the requirements for the DR District, which permitted up to 150 surface spaces. Current RIV-NS District permits a maximum of 75 surface spaces.","Decision: The Applicant’s request for an extension of the conditions set forth in ZoneCase No. 287 of 2016 is APPROVED, as modified as follows:• As based on the issuance of the building permit in April 2017, theoriginal condition in Zone Case No. 287 of 2016 currently extends toApril 2024;• With this decision, the original condition is further extended to April2026; and• Before the April 2026 expiration of the original condition, theApplicant shall seek approval for the continuation of the surfaceparking lot for an additional 3 years, as a special exception, inaccordance with the provisions for temporary surface parking lots inSection 905.04.I, or shall seek permanent variances from all applicablestandards for surface parking lots in accordance with the ZoningCode provisions then applicable."
"March 11, 2021 (Virtual Hearing)","April 22, 2021",16 of 2020,640 Science Street,Variance,Section 903.03.C.2,"30’ minimum rear setback, 19.2’ proposed","Decision: The Applicant’s request for a variance from the maximum number of storiesprovision and the interior side setback standard in Sections 903.03.C.2 and925.06.C are hereby APPROVED, and the request for a variance from the rearsetback standard in Section 903.03.C.2 is hereby DENIED."
"March 11, 2021 (Virtual Hearing)","April 22, 2021",16 of 2020,640 Science Street,Variance,Section 903.03.C.2,"3 stories maximum permitted height, 4 stories proposed","Decision: The Applicant’s request for a variance from the maximum number of storiesprovision and the interior side setback standard in Sections 903.03.C.2 and925.06.C are hereby APPROVED, and the request for a variance from the rearsetback standard in Section 903.03.C.2 is hereby DENIED."
"March 11, 2021 (Virtual Hearing)","April 22, 2021",16 of 2020,640 Science Street,Variance,Section 925.06.C,"3’ minimum interior side setback, 2.9’ proposed","Decision: The Applicant’s request for a variance from the maximum number of storiesprovision and the interior side setback standard in Sections 903.03.C.2 and925.06.C are hereby APPROVED, and the request for a variance from the rearsetback standard in Section 903.03.C.2 is hereby DENIED."
"September 15, 2022 (Virtual Hearing)","November 5, 2022",171 of 2022,642 Fort Duquesne Boulevard,Variance,Section 910.01.H.2 (b),7.5:1 maximum floor area ratio (FAR) permitted; 9.5:1 requested,"Decision: The Applicant’s request for a dimensional variance from Section 910.01.H(2) toallow the construction of a rooftop addition on an existing building, whichwould increase the legally nonconforming Floor Area Ratio from 9:1 to 9.5:1, ishereby APPROVED."
"May 11, 2023 (Virtual Hearing)","June 27, 2023",48 of 2023,6465 Hamilton Avenue,Special Exception,Sections 911.02 and,Multi-Unit Residential,"Decision: The Applicant’s request for special exceptions pursuant to Sections 911.02 and911.04.A.85 and Section 904.07.C.4 to allow a 58’-8”/five story multi-unitresidential building in a UI District, is hereby APPROVED, subject to theconditions that both the mitigation measures, described in the transportationimpact study, and a comprehensive traffic demand management strategy shallbe implemented in coordination with DOMI’s review and approval."
"May 11, 2023 (Virtual Hearing)","June 27, 2023",48 of 2023,6465 Hamilton Avenue,Special Exception,Section 904.07.C.4,"Additional height above four stories permitted as a special exception, five stories proposed","Decision: The Applicant’s request for special exceptions pursuant to Sections 911.02 and911.04.A.85 and Section 904.07.C.4 to allow a 58’-8”/five story multi-unitresidential building in a UI District, is hereby APPROVED, subject to theconditions that both the mitigation measures, described in the transportationimpact study, and a comprehensive traffic demand management strategy shallbe implemented in coordination with DOMI’s review and approval."
"January 21 ,2021 (Virtual Hearing)","March 5, 2021",13 of 2021,6504 Jackson St,Variance,Section 903.03.C.2,"30’ front setback required, 9’- 10” requested for exterior staircase",Decision: The Applicant’s request for a variance from the front setback requirement ofSection 903.03.C.2 to allow a 9’-10” setback for the staircase is herebyAPPROVED.
"January 12, 2023 (Virtual Hearing)","February 15, 2023",259 of 2022,6513 Meadow Street,Variance,Section 912.04.K.3(a),4’ maximum height for fences in front and exterior side yards; fence higher than 5’ proposed,"Decision: The Applicant’s request for a variance from Section 912.04.K.3(a) and a specialexception pursuant to Section 916.04.A to allow for the construction of a 6’high open fence enclosing a green space, which would be accessory to theUrban Academy charter school, is hereby APPROVED."
"January 12, 2023 (Virtual Hearing)","February 15, 2023",259 of 2022,6513 Meadow Street,Special Exception,Section 916.04.A,50’ residential compatibility playground setback,"Decision: The Applicant’s request for a variance from Section 912.04.K.3(a) and a specialexception pursuant to Section 916.04.A to allow for the construction of a 6’high open fence enclosing a green space, which would be accessory to theUrban Academy charter school, is hereby APPROVED."
"January 21,2021 (Virtual Hearing)","March 5, 2021",15 of 2021,6514 Wilkins Avenue,Special Exception,Section 921.02.A.4,Change of nonconforming use,Decision: The Applicant’s request for a special exception pursuant to Section 921.02.A.4to allow the change of the nonconforming retail use to the nonconformingoffice (limited) use is hereby APPROVED.
"April 14, 2022 (Virtual Hearing)","May 9, 2022",73 of 2022,6517 Dean Street,Variance,Section 903.03.C.2,"3,200 sf minimum lot size, 1,481 to 2,003 sf requested","Decision: The Applicant’s request for a variance from the minimum lot size requirementin Section 903.03.C.2, to allow subdivision of the Subject Property into fourlots, with lot sizes under 3,200 sf, as described, is hereby APPROVED."
"January 13, 2022 (Virtual Hearing)","January 24, 2022",8 of 2022,6539 Aylesboro Ave.,Variance,Section 912.04.C,"5’ side setback required, 4’-4’’ requested",Decision: The Applicant’s request for a variance from Section 912.04.C to allow a shedwith a limited interior side setback is hereby APPROVED.
"August 5, 2021 (Virtual Hearing)","August 27, 2021",161 of 2021,6550 Hamilton Avenue,Variance,Section 912.04.B,"Minimum rear setback is 5‘, 0’ requested","Decision: The Applicant’s request for variances from Sections 912.04.A, 912.04.B, and918.03.B.4 to allow for a 61 space parking lot with limited side and rearsetbacks and screening in the right-of-way is hereby APPROVED."
"August 5, 2021 (Virtual Hearing)","August 27, 2021",161 of 2021,6550 Hamilton Avenue,Variance,Section 912.04.C,"Minimum side setback is 10’, 4.8’ requested","Decision: The Applicant’s request for variances from Sections 912.04.A, 912.04.B, and918.03.B.4 to allow for a 61 space parking lot with limited side and rearsetbacks and screening in the right-of-way is hereby APPROVED."
"August 5, 2021 (Virtual Hearing)","August 27, 2021",161 of 2021,6550 Hamilton Avenue,Variance,Section 918.03.B.4,All required screening shall be located within the site’s property lines,"Decision: The Applicant’s request for variances from Sections 912.04.A, 912.04.B, and918.03.B.4 to allow for a 61 space parking lot with limited side and rearsetbacks and screening in the right-of-way is hereby APPROVED."
"July 20, 2023 (Virtual Hearing)","September 21, 2023",46 of 2023,6556 Shetland Street,Variance,Section 919.03.O,Electronic non-advertising signs are not permitted in RM-H District,"Decision: For the foregoing reasons, the Applicant’s request for approval of the newelectronic sign is APPROVED, subject to these conditions:1. The sign must be fully turned off from sunset until sunrise;2. During daytime hours, brightness/luminance shall be no greater than2,500 nits; and3. The sign shall be used for the display of static text and graphicsonly, with no animated displays."
"October 21, 2021 (Virtual Hearing)","November 29, 2021",227 of 2021,6600 Northumberland Street,Variance,Section 925.06.A.2,"4’ maximum fence height, 6’ requested","Decision: The Applicant’s request for variances from Sections 925.06.A.2 and 912.04.C toallow the replacement of an existing 6’ high fence within the exterior sidesetback with a new 6’ high fence, with a shadow box design, and theconstruction of an accessory pergola with a 0’ interior side setback is herebyAPPROVED."
"October 21, 2021 (Virtual Hearing)","November 29, 2021",227 of 2021,6600 Northumberland Street,Variance,Section 912.04.C,"5’ side setback required, 0’ requested for pergola","Decision: The Applicant’s request for variances from Sections 925.06.A.2 and 912.04.C toallow the replacement of an existing 6’ high fence within the exterior sidesetback with a new 6’ high fence, with a shadow box design, and theconstruction of an accessory pergola with a 0’ interior side setback is herebyAPPROVED."
"April 14,2022 (Virtual Hearing)","June 13, 2022",80 of 2022,6633 Northumberland Street,Appeal,Section 923.03.B.1,Appeal of the approval of zoning application #DCP- ZDR-2020-05624 for new construction of a new structure for four-unit residential use and continue use of existing structure for a single-unit residential use.,"Decision: For the foregoing reasons, the Appellant’s protest appeal is hereby DENIED,subject to the condition that the unit group development, as proposed, mayonly continue on the 9,600 sf Subject Property, in compliance with the sitedevelopment standards and without subdivision of the 9,600 sf parcel."
"May 2, 2024","June 10, 2024",14 of 2024,6735 Thomas Boulevard,Special Exception,Section 921.02.A.4,Change of non-conforming use from Childcare (General) with two residential units to three residential units,Decision: The Applicant’s request for a special exception pursuant to Section921.02.A.1 to allow the conversion of the childcare space in the existingstructure into a third dwelling unit is hereby APPROVED.
"August 10, 2023 (Virtual Hearing)","September 7, 2023",106 of 2023,67-69 Becks Run Road,Variance,Section 912.04.L.3,"Residential Parking pads prohibited in front yard, three- car parking pad in front yard proposed","Decision: The Applicant’s request for a variance from Section 912.04.L.3 to allow for theinstallation of a three-car parking pad located in the front yard, as describedto the Board, is hereby APPROVED, subject to the condition that the curb cutfor the parking pad shall be reviewed and approved by the Department ofMobility and Infrastructure."
"May 1, 2025","May 23, 2025",20 of 2025,690 Greentree Road,Variance,Section 911.02,Construction contractor (general) not permitted in NDI District,"Decision: The Applicant’s request for a variance from Section 911.02 to allow thecontinued use of the limited portion of the Subject Property currently beingused for storage of construction vehicles and supplies, as described is herebyAPPROVED, subject to the following conditions: the curb cut shall be reviewedand approved by the Department of Mobility and Infrastructure; and anyexpansion of the use onto areas of the site that currently are not used for thestorage of construction vehicles and supplies is prohibited."
"February 1, 2024 (Virtual Hearing)","February 8, 2024",200 of 2023,6902 Yorkshire Drive,Variance,Section 912.04.K(1),"Fences in exterior side yard shall be open and not higher than 4’, 6’ high privacy fence proposed","Decision: The Applicant’s request for a variance from Section 912.04.K to allow theconstruction of a 6’ high semi-opaque fence is hereby approved, subject to thecondition that the fence shall be at least 3’ from the South Dallas Avenueproperty line and shall have a shadow box design, as presented to the Board."
"May 8, 2025","June 11, 2025",50 of 2025,6910 Meade Street,Variance,Section 912.04,Fences in front yard must be open and not higher than 4’; 6’ high privacy fence proposed,"Decision: The Applicant’s request for a variance from Section 912.04.K to allow theconstruction of a 6’ high fence within the front setback is hereby APPROVED,subject to the condition that the fence shall contain transparent elements, aspresented to the Board."
"July 20, 2023 (Virtual Hearing)","August 22, 2023",95 of 2023,6920 Bennett Street,Variance,Section 903.03.C.2,"10’ interior side setback required, 1’6” and 3’ requested","Decision: The Applicant’s request for variances from Sections 903.03.C.2 and 914.02.A toallow for the construction of two two-unit residential structures, with limitedinterior side setbacks, as described, and no off-street parking is herebyAPPROVED."
"July 20, 2023 (Virtual Hearing)","August 22, 2023",95 of 2023,6920 Bennett Street,Variance,Section 903.03.C.2,"1,800 sf minimum lot size per unit, 1,100 sf provided","Decision: The Applicant’s request for variances from Sections 903.03.C.2 and 914.02.A toallow for the construction of two two-unit residential structures, with limitedinterior side setbacks, as described, and no off-street parking is herebyAPPROVED."
"July 20, 2023 (Virtual Hearing)","August 22, 2023",95 of 2023,6920 Bennett Street,Variance,Section 914.02.A,"One parking space per unit required, 0 parking spaces requested","Decision: The Applicant’s request for variances from Sections 903.03.C.2 and 914.02.A toallow for the construction of two two-unit residential structures, with limitedinterior side setbacks, as described, and no off-street parking is herebyAPPROVED."
"December 9, 2021 (Virtual Hearing)","December 27, 2021",225 of 2021,701 Hazelwood Avenue,Review,Section 919.01.F,Sign for non-conforming use,"Decision: The Applicants request for a 90 sf wall sign to identify the non-conforminganimal care (general) use in the R1D-H District is hereby APPROVED, subjectto the condition that no other business identification signage is permitted onthe structure."
"May 6, 2021 (Virtual Hearing)","June 11, 2021",97 of 2021,701 N. St. Clair Street,Variance,Section 903.03.D.2,"15’ exterior side setback required, 2.6’ proposed","Decision: The Applicant’s request for variances from Sections 903.03.D.2 and 925.06.C toconstruct a 6’ high privacy fence in an exterior side yard is hereby APPROVED,subject to the condition that landscaping is provided between the property lineand fence."
"May 6, 2021 (Virtual Hearing)","June 11, 2021",97 of 2021,701 N. St. Clair Street,Variance,Section 925.06.C,"4’ maximum fence height in exterior side setback, 6’ proposed","Decision: The Applicant’s request for variances from Sections 903.03.D.2 and 925.06.C toconstruct a 6’ high privacy fence in an exterior side yard is hereby APPROVED,subject to the condition that landscaping is provided between the property lineand fence."
"December 3, 2020 (Virtual Hearing)","January 18, 2021",220 of 2020,702-710 Copeland Street,Variance,Section 903.03.C.2,Minimum 30’ front setback required; 16’6’’ requested,Decision: The Applicant’s request for a variance from Section 903.03.C.2 is herebyAPPROVED.
,"April 16, 2021",36 of 2021,703 N. Negley Avenue,Variance,912.04.C and 925.06.A,"25’ exterior side setback required, 0’ requested for privacy fence","Decision: The Applicant’s request for variances from Sections 903.03.C.2, 912.04.C and925.06.A is hereby DENIED."
"September 22, 2022 (Virtual Hearing)","November 3, 2022",196 of 2022,706 Cedar Avenue,Variance,Sections 903.03.E.2/925.06.C,"3’ setback required, 0’ requested for portion of the structure above the roofline of the adjacent structure",Decision: The Applicant’s request for a variance from Sections 903.03.E.2/925.06.C toallow for a structure with 0’ interior side setbacks is hereby APPROVED.
"October 5, 2023 (Virtual Hearing)","November 20, 2023",104 of 2023,709 and 715 South Aiken Avenue,Variance,Section 912.04.A,"30’ front setback required, 0’ requested","Decision: The Applicant’s request for a variance from Section 912.04.A to allow a chickencoop with a 0’ front setback is hereby DENIED. This decision is not to beenforced for a year, provided that the urban agriculture use is not expanded onthe site and the number of chickens is limited to two during that time."
"September 3, 2020 (Virtual Hearing)","October 12, 2020",154 of 2020,711 Bingham,Variance,Section 919.03.M.5,"Maximum letter height 8”, 15.5’’ proposed",Decision: The Applicant’s request for a variance from Section 919.03.M.5 is herebyAPPROVED.
"November 7, 2024","November 27, 2024",160 of 2024,711 Forbes Avenue,Variance,Section 919.03.M.3,"Maximum Sign Height 40’, 49’ requested","Decision: The Applicant’s request for a variance from Section 919.03.M.3 to allow for theinstallation of two 80 sf wall signs, at a height 49’ from grade is herebyAPPROVED."
"July 8, 2021 (Virtual Hearing)","August 12, 2021",152 of 2020,7111 Reynolds Street,Special Exception,Section 921.02.A.4,Change use of portion of structure from Public Assembly (limited) to Retail Sales and Services (limited),"Decision: The Applicant’s request for a special exception pursuant to Section 921.02.A.4is hereby APPROVED, subject to these conditions:• The coffee shop shall be permitted only within the 1,108 sf space identified;• The separate public assembly and coffee shop uses shall not operate at thesame time and the coffee shop shall be closed during those times when “publicassembly” event is taking place;• The hours of operation of the coffee shop shall not extend past 3 p.m.;• The coffee shop shall not be changed to any other type of retail sales orservice use without the appropriate approvals; and• No electronic signage of any kind shall be permitted anywhere on thestructure’s façade, including signs in ground floor windows."
"March 6, 2025","April 3, 2025",8 of 2025,7119 Hamilton Avenue,Variance,Section 916.09,"30’ residential compatibility setback required, 6’ requested",Decision: The Applicant’s request for a special exception pursuant to Section 916.09 towaive the residential compatibility setback standard for dumpsters in Section916.04.B to allow a dumpster enclosure that would be located 24’ from aresidential-zoned property is hereby APPROVED.
"October 8, 2020 (Virtual Hearing)","November 20, 2020",182 of 2020,2 713 Queensboro Avenue,Variance,Section 903.03.C.2,"Minimum 5’ interior side setback required, 2’ requested",Decision: The Applicant’s request for a variance from Section 903.03.C.2 is herebyAPPROVED.
"March 18, 2021 (Virtual Hearing)","May 2, 2021",52 of 2021,714 Amberson Avenue,Variance,Section 912.04.C,30’ minimum front setback; 0’ setback for 6.5’ wall requested,"Decision: The Applicant’s request for variances from Section 912.04.C and Section925.06.C, to allow a retaining wall, with a height not to exceed 5’, with an open3’ wrought iron fence on top of the wall, and with sectional piers that do notexceed the height of 8’, with 0’ front and exterior side setbacks, is herebyAPPROVED."
"March 18, 2021 (Virtual Hearing)","May 2, 2021",52 of 2021,714 Amberson Avenue,Variance,Section 912.04.C,30’ minimum exterior side setback; 0’ setback for 8.5’ wall requested,"Decision: The Applicant’s request for variances from Section 912.04.C and Section925.06.C, to allow a retaining wall, with a height not to exceed 5’, with an open3’ wrought iron fence on top of the wall, and with sectional piers that do notexceed the height of 8’, with 0’ front and exterior side setbacks, is herebyAPPROVED."
"March 18, 2021 (Virtual Hearing)","May 2, 2021",52 of 2021,714 Amberson Avenue,Variance,Section 925.06.C,"4’ maximum wall height in required front or exterior side setback, 6’ requested","Decision: The Applicant’s request for variances from Section 912.04.C and Section925.06.C, to allow a retaining wall, with a height not to exceed 5’, with an open3’ wrought iron fence on top of the wall, and with sectional piers that do notexceed the height of 8’, with 0’ front and exterior side setbacks, is herebyAPPROVED."
"November 19, 2020 (Virtual Hearing)","December 31, 2020",215 of 2020,714 South Aiken Avenue,Variances,912.04.A and 925.06.A,"30’ front setback required, 5’ proposed for 6’ privacy fence","Decision: The Applicant's request for variances from Code Sections 903.03.E.2, 912.04.Aand 925.06.A.2 is hereby DENIED."
